{
  "schema": "claude-legal-audit.argument-mesh.v1",
  "revision": "1.0.0",
  "status": "candidate",
  "method_document": "docs/ARGUMENT_MESH_STANDARD.md",
  "aliases": [
    {"alias": "Ajax Line", "descriptive_name": "collective attorney brain-trust sovereignty thesis", "authority": "mnemonic_only"}
  ],
  "objects": [
    {"object_id":"THY-0001","object_type":"theory","title":"Collective professional knowledge sovereignty","statement":"Professional firms create value through a changing interaction graph of people, tasks, tools, judgment, rationales, outcomes, and governance whose externalization can create firm-level and sector-level effects.","epistemic_status":"Hypothesis","review_status":"candidate","scope":"Large law firms and adjacent knowledge-intensive professional services using frontier AI.","does_not_prove":"That every interaction is proprietary, transferable, retained, or usable by a model.","claim_ids":["CLM-0014","CLM-0015"],"source_ids":["SRC-0046","SRC-0047","SRC-0048"],"applies_when":["A workflow exposes recurring professional interactions or derived representations to an external system."],"does_not_apply_when":["The system is demonstrably local, purpose-limited, non-retaining, and unable to generalize the interaction graph."],"danger_if_misapplied":"Treating all professional knowledge as exclusive property can obscure public law, client rights, employee mobility, and ordinary learning."},
    {"object_id":"THS-0001","object_type":"thesis","title":"The Ajax Line: hold the line","statement":"Each major law firm should independently maintain a defensive boundary around its collective attorney brain-trust data and derived representations because peer exposure could create an upstream capability that reduces overlapping differentiation, including for protective holdouts.","epistemic_status":"Normative","review_status":"candidate","scope":"Unilateral precautionary contractual, technical, professional-responsibility, and interoperability governance; open, voluntary, nonexclusive standards; not competitor agreement or market coordination.","does_not_prove":"A named provider currently pools law-firm knowledge, that the predicted competitive effect has occurred, or that competitors may jointly refuse vendors or impose shared dealing terms.","claim_ids":["CLM-0001","CLM-0003","CLM-0015","CLM-0016"],"source_ids":["SRC-0046","SRC-0047","SRC-0048","SRC-0049"],"applies_when":["A firm independently evaluates provider rights, telemetry, feedback, evaluation, and derived-data boundaries that are incomplete or unverified."],"does_not_apply_when":["The proposition is used for coordinated vendor refusal, jointly imposed contract terms, supplier pressure, exchange of current procurement positions, or coordination of price, clients, hiring, markets, or other competitively sensitive conduct."],"danger_if_misapplied":"An industry-protection argument can become an unsupported accusation, group boycott, anticompetitive coordination, or resistance to beneficial and controlled AI use."},
    {"object_id":"ARG-0001","object_type":"supporting_argument","title":"The brain trust is an interaction graph","statement":"Documents are only one projection of professional knowledge; recurring relationships among people, tasks, tools, exceptions, choices, rationales, and outcomes can encode valuable operating and judgment patterns.","epistemic_status":"Inferred","review_status":"candidate","scope":"Operational and professional-judgment ontology, excluding unsupported claims about client content or provider intent.","does_not_prove":"That sparse metadata alone reconstructs correct legal judgment or transfers tacit organizational context.","claim_ids":["CLM-0001","CLM-0014"],"source_ids":["SRC-0002","SRC-0047","SRC-0048"],"applies_when":["Repeated workflow and decision signals can be linked with adequate context and genealogy."],"does_not_apply_when":["Signals are isolated, decontextualized, randomized, or technically unavailable to the upstream system."],"danger_if_misapplied":"Calling every workflow trace a brain-trust asset can inflate weak metadata into false evidence of legal strategy."},
    {"object_id":"ARG-0002","object_type":"supporting_argument","title":"Peer contribution can create a sector externality","statement":"If many firms authorize retention or generalized improvement from overlapping professional interaction data, each contribution may strengthen a shared upstream capability whose benefits and competitive effects extend beyond the contributing firm.","epistemic_status":"Hypothesis","review_status":"candidate","scope":"Conditional competition and data-governance risk, not a claim about current provider behavior.","does_not_prove":"Actual aggregation, market tipping, causation, or a measurable reduction in law-firm value.","claim_ids":["CLM-0015"],"source_ids":["SRC-0046"],"applies_when":["Cross-customer derived use is legally and technically permitted and the exposed patterns are substitutable."],"does_not_apply_when":["Customer data and derivatives remain isolated, non-retained, non-generalized, and independently auditable."],"danger_if_misapplied":"A conditional externality can be misstated as proof of covert pooling or inevitable market collapse."},
    {"object_id":"ARG-0003","object_type":"supporting_argument","title":"A protective holdout can still face overlap exposure","statement":"A firm that protects its own ontology may still face a stronger substitute built from peers when professional domains and recurring decision structures overlap sufficiently.","epistemic_status":"Hypothesis","review_status":"candidate","scope":"Relative competitive differentiation under a multi-firm exposure scenario.","does_not_prove":"That law-firm ontologies overlap enough in practice or that unique culture and client relationships are reproducible.","claim_ids":["CLM-0015"],"source_ids":["SRC-0046","SRC-0047"],"applies_when":["Peer data covers substantially substitutable issues, options, evaluations, and outcomes."],"does_not_apply_when":["Firm-specific advantage is predominantly tacit, relational, non-transferable, or absent from exposed traces."],"danger_if_misapplied":"The overlap hypothesis can erase genuine firm differences or be used to make unsupported claims about Kirkland or another named firm."},
    {"object_id":"ARG-0004","object_type":"supporting_argument","title":"Move-37-like strategic discontinuity is possible but unproven in law","statement":"AlphaGo's Move 37 demonstrates that learned evaluation and search in a closed strategic domain can select an unconventional action whose value becomes clear much later; it motivates testing for analogous delayed-value legal strategies.","epistemic_status":"Inferred","review_status":"candidate","scope":"Analogy and benchmark motivation only; not a cross-domain performance claim.","does_not_prove":"Legal creativity, legal correctness, consciousness, general intelligence, or transfer from Go to law.","claim_ids":["CLM-0011","CLM-0013"],"source_ids":["SRC-0042","SRC-0043","SRC-0045"],"applies_when":["The analogy is paired with explicit domain differences and an empirical legal benchmark."],"does_not_apply_when":["Move 37 is used rhetorically as proof that frontier systems can already out-strategize lawyers."],"danger_if_misapplied":"A vivid analogy can overwhelm weak evidence and create false inevitability."},
    {"object_id":"OBJ-0001","object_type":"objection","title":"No evidence of current covert pooling","statement":"The public record reviewed does not establish that Anthropic or another named frontier provider covertly pools identifiable law-firm ontologies or trains on ordinary commercial content by default.","epistemic_status":"Observed","review_status":"candidate","scope":"Current registered public sources and pinned public repository only.","does_not_prove":"Perfect implementation, zero retention, identical negotiated terms, or harmless future practices.","claim_ids":["CLM-0003","CLM-0010"],"source_ids":["SRC-0002","SRC-0005"],"applies_when":["The paper discusses current provider conduct or intent."],"does_not_apply_when":["A future exact source, contract, or runtime test establishes a different bounded fact."],"danger_if_misapplied":"Ignoring this objection converts a precautionary thesis into an unsupported allegation."},
    {"object_id":"OBJ-0002","object_type":"objection","title":"AI can complement and differentiate firms","statement":"Firm-controlled AI can improve quality, speed, access, consistency, training, and strategic experimentation, so external AI use need not flatten law firms or transfer their control plane.","epistemic_status":"Hypothesis","review_status":"candidate","scope":"Controlled deployments with aligned rights, architecture, professional duties, and human accountability.","does_not_prove":"That every deployment is complementary or that productivity gains are evenly distributed.","claim_ids":["CLM-0008"],"source_ids":["SRC-0041"],"applies_when":["The firm controls ontology, evaluation, data rights, portability, and professional decisions."],"does_not_apply_when":["Control, derived rights, or exit capability are absent or merely assumed."],"danger_if_misapplied":"A complementarity story can conceal dependency, deskilling, or silent transfer of high-value derived knowledge."},